[{"data":null,"decision":null,"error":{"code":"stale_capability","message":"mapping table catalog digest does not match runtime catalog","retryable":false},"kind":"result","provenance":{"capability":null,"content_kind":null,"duration_ms":null,"runtime":null,"trust":null,"trusted":null},"request_id":"call_21a","status":"rejected"}]
