[{"data":{"content":"mock content of /repo/a.txt","path":"/repo/a.txt"},"decision":null,"error":null,"kind":"result","provenance":{"capability":"read_file","content_kind":"tool_result","duration_ms":null,"runtime":"mock","trust":"unknown","trusted":null},"request_id":"call_i41a","status":"ok"},{"data":null,"decision":{"approval":null,"authority":{"decision_id":null,"policy_engine":"mock.policy","runtime":"mock"},"capability":"write_file","constraints":[],"decision":"denied","kind":"decision","reason":"mock policy: writes are denied","request_id":"call_i41b","runtime_state":null},"error":{"code":"policy_denied","message":"mock policy: writes are denied","retryable":false},"kind":"result","provenance":{"capability":"write_file","content_kind":null,"duration_ms":null,"runtime":"mock","trust":null,"trusted":null},"request_id":"call_i41b","status":"denied"},{"data":{"entries":["a.txt","b.txt"],"path":"/repo"},"decision":null,"error":null,"kind":"result","provenance":{"capability":"list_dir","content_kind":"tool_result","duration_ms":null,"runtime":"mock","trust":"unknown","trusted":null},"request_id":"call_i41c","status":"ok"},{"data":{"content":"mock content of /repo/b.txt","path":"/repo/b.txt"},"decision":null,"error":null,"kind":"result","provenance":{"capability":"read_file","content_kind":"tool_result","duration_ms":null,"runtime":"mock","trust":"unknown","trusted":null},"request_id":"call_i41d","status":"ok"}]
