[{"data":null,"decision":{"approval":null,"authority":{"decision_id":null,"policy_engine":"mock.policy","runtime":"mock"},"capability":"write_file","constraints":[],"decision":"denied","kind":"decision","reason":"mock policy: writes are denied","request_id":"call_05a","runtime_state":null},"error":{"code":"policy_denied","message":"mock policy: writes are denied","retryable":false},"kind":"result","provenance":{"capability":"write_file","content_kind":null,"duration_ms":null,"runtime":"mock","trust":null,"trusted":null},"request_id":"call_05a","status":"denied"}]
