[{"data":null,"decision":null,"error":{"code":"execution_error","message":"runtime returned a result for another request","retryable":false},"kind":"result","provenance":{"capability":"read_file","content_kind":"tool_result","duration_ms":null,"runtime":"mock","trust":"unknown","trusted":null},"request_id":"call_i36a","status":"error"},{"data":null,"decision":{"approval":null,"authority":{"decision_id":null,"policy_engine":"mock.policy","runtime":"mock"},"capability":"send_email","constraints":[],"decision":"denied","kind":"decision","reason":"mock policy: external side effects are denied","request_id":"call_i36b","runtime_state":null},"error":{"code":"policy_denied","message":"mock policy: external side effects are denied","retryable":false},"kind":"result","provenance":{"capability":"send_email","content_kind":null,"duration_ms":null,"runtime":"mock","trust":null,"trusted":null},"request_id":"call_i36b","status":"denied"}]
